{"token_id":"00000000-0000-7000-8000-000000000005","intent_id":"00000000-0000-7000-8000-000000000001","expected_revision_id":"00000000-0000-7000-8000-000000000002","item_id":"00000000-0000-7000-8000-000000000006","actor_id":"alice","before_statement":"before","after_statement":"after","before_hash":"0000000000000000000000000000000000000000000000000000000000000000","after_hash":"1111111111111111111111111111111111111111111111111111111111111111","issued_at":"2026-09-11T00:00:00Z","expires_at":"2026-09-11T00:05:00Z","consumed":false}
